{"kind":"postgresql-two-table-export","limits":{"max_output_bytes":1073741824,"max_rows":300000,"statement_timeout_ms":300000,"wall_timeout_ms":600000},"observed":{"bytes":65,"complete":true,"elapsed_ms":10,"rows":4},"pair_plan_sha256":"655181599f7ebf9d428d34354d9c7390e29e10747b79326531f38c09b7d7efd2","postgres_pair_receipt_version":1,"source":{"database":"database-a","role":"reader","server_version_num":160000,"source_id":"pg16"},"table_manifests":{"order_lines":"1f063afff41a5df6c4e10c9cff673e6ff315f457a1ef2fadc9a72f9211db4e2c","orders":"b93d89fa085c438a44aae12ed0b1adb32748716a7f66fa1db0eb0bd399547e9b"},"transaction":{"isolation":"repeatable read","read_only":true,"row_security":"off","snapshot":"1:2:"}}
