{"kind":"postgresql-two-table-export","limits":{"max_output_bytes":1073741824,"max_rows":300000,"statement_timeout_ms":300000,"wall_timeout_ms":600000},"observed":{"bytes":65,"complete":true,"elapsed_ms":10,"rows":4},"pair_plan_sha256":"464084e188e646268105f9e9258515cff0ffa38c3ea8a5a86ae31fd3ed63f9fd","postgres_pair_receipt_version":1,"source":{"database":"database-a","role":"reader","server_version_num":180000,"source_id":"pg18"},"table_manifests":{"order_lines":"6889a80ebb204156f61543c0941a4683b35b6b3ae359ab2ec1bc90636ebdbbf1","orders":"1d63514919bdc0db20a9f113b3cde8e0852b34800a47d3434f50970b82d6fd70"},"transaction":{"isolation":"repeatable read","read_only":true,"row_security":"off","snapshot":"1:2:"}}
