{"kind":"postgresql-two-table-export","limits":{"max_output_bytes":1000,"max_rows":10,"statement_timeout_ms":1000,"wall_timeout_ms":2000},"observed":{"bytes":36,"complete":true,"elapsed_ms":10,"rows":2},"pair_plan_sha256":"6278307cec73ad32e365f9eba13b1be9c3a0f6e1c9eb097fbb2f2ab4eed12234","postgres_pair_receipt_version":1,"source":{"database":"database-a","role":"reader","server_version_num":180006,"source_id":"source-a"},"table_manifests":{"order_lines":"ad310b393c2563d0419b2a748832f5d861fe7b06bb03b70cdfbec299c38b93fb","orders":"23b6d4144c4f6c1d13181ee4ed5c6075d4ca32ca8e3fbf03dde9478f0e999660"},"transaction":{"isolation":"repeatable read","read_only":true,"row_security":"off","snapshot":"1:2:"}}
